{
  "id": "barkas",
  "created_at": "2026-03-17T12:00:00Z",
  "status": "expanded",
  "business": {
    "name": "Barkas",
    "description": "Мультибрендовий інтернет-магазин з продажу човнів, обладнання для них, аксесуарів та комплектуючих",
    "services": [
      "Продаж човнів різних брендів",
      "Продаж обладнання для човнів",
      "Продаж аксесуарів та комплектуючих",
      "Професійна консультація та підбір"
    ],
    "usp": "Ціни та гарантія від виробника без націнок, підтримка клієнтів, великий асортимент, система знижок, зручний сервіс, досвідчені консультанти"
  },
  "audience": {
    "description": "Переважно чоловіки від молодого до пенсійного віку, будь-який рівень доходу — від бюджетних одномісних надувних човнів до преміальних катерів. Також готелі та бази відпочинку для оренди відпочиваючим",
    "problem": "Потрібен великий вибір плавзасобів та комплектуючих до них з професійною консультацією та підбором необхідного обладнання",
    "objections": "Нерозуміння що потрібно для повного комплекту і неготовність до фінальної ціни. Рідше — ще не прийняте остаточне рішення щодо моделі і бренду"
  },
  "website": {
    "pages": [
      "Головна",
      "Каталог",
      "Категорія товарів",
      "Картка товару",
      "Кошик",
      "Оформлення замовлення",
      "Подяка за замовлення",
      "Улюблені товари",
      "Порівняння товарів",
      "Акції",
      "Новини",
      "Сторінка новини",
      "Про нас",
      "Доставка і оплата",
      "Гарантія",
      "Контакти"
    ],
    "primary_action": "Покупка через кошик. Вторинна конверсія: дзвінок, замовлення дзвінка, форма зворотного зв'язку для консультації",
    "special_features": "Повноцінний e-commerce: каталог з категоріями, фільтрація, кошик, порівняння товарів, список улюблених"
  },
  "visual": {
    "references": "https://priliv.com.ua/ — частково подобається, але не відповідає повністю. Бажане відчуття: не перевантажений магазин де все навішано одне на одне, а простір де представлені поодинокі моделі-представники кожної групи, легко обрати напрямок і далі конкретний товар",
    "colors": "Кольори води, морська хвиля, лазур. Поточні кольори логотипу: #01bfc4 та #0590dd",
    "mood": "О! Нарешті я знайшов той магазин, який давно шукав"
  },
  "content": {
    "existing_materials": "Логотип (човен з парусом на хвилях, поряд назва з хвилею, кольори #01bfc4 та #0590dd), фото товарів, тексти",
    "additional_notes": ""
  }
}
