{
  "id": "test-project",
  "created_at": "2026-03-17T12:00:00.000Z",
  "status": "draft",
  "business": {
    "name": "DiVotek",
    "description": "Компанія з розробки вебсайтів з досвідом понад 15 років",
    "services": [
      "Створення сайтів",
      "SEO",
      "Маркетинг"
    ],
    "usp": "Досвід більше 15 років, гарантійний період, висококваліфіковані програмісти, ціни формуються від складності проекту, а не зі стелі"
  },
  "audience": {
    "description": "30-50 років, жінки/чоловіки 60%/40%, дохід середній або вище середнього. Потреби: розширення бізнесу, представлення компанії в інтернеті, збільшення обертів, впізнаваність бренду",
    "problem": "Потребують проект під ключ: супровід на стартовому етапі, навчання роботі з сайтом, індивідуальні функціональні рішення на вимогу клієнта",
    "objections": "Вартість — конкуренти можуть знижувати ціни за рахунок якості. Нечітке усвідомлення клієнтом того, що він хоче отримати у вигляді готового продукту. Багато етапів, які можуть вийти в незрозумілі строки"
  },
  "website": {
    "pages": [
      "Головна",
      "Про нас",
      "Контакти",
      "Створення сайтів (категорія послуг)",
      "Сторінка послуги (створення сайтів)",
      "SEO та маркетинг (категорія послуг)",
      "Сторінка послуги (SEO/маркетинг)",
      "Блог (категорія статей)",
      "Сторінка статті блогу",
      "Портфоліо (категорія робіт)",
      "Сторінка роботи (портфоліо)"
    ],
    "primary_action": "Замовити сайт, замовити послугу SEO/маркетинг, замовити консультацію",
    "special_features": "Каталог послуг з окремими сторінками для кожної послуги, блог зі статтями, портфоліо з роботами"
  },
  "visual": {
    "references": "Відчуття професіоналізму і простоти. Відвідувач має розуміти, що тут він отримає професійні послуги. Для категорії клієнтів, які шукають дешево — має складатись враження недоступності",
    "colors": "Основний акцент: #3573e9 (іконка логотипу, можна погратись з контрастом), темний: #364252, основа: світла — білий або світло-сірий",
    "mood": "Спокій, урівноваженість, обдуманість, готовність до рішення"
  },
  "content": {
    "existing_materials": "Логотип, брендбук по кольорах. Тексти і фото будуть оновлюватись",
    "additional_notes": "Гра форм, професійні анімації та ефекти. Відсутність банальних заїжджених текстур та декоративних елементів. Тільки професійне і щось нове, ексклюзивне"
  }
}
