{
  "id": "remka-pro",
  "created_at": "2026-03-17T12:00:00Z",
  "status": "draft",

  "business": {
    "name": "RemkaPro",
    "description": "Ремонт побутової техніки в Дніпрі",
    "services": [
      "Ремонт пральних машин",
      "Ремонт холодильників",
      "Ремонт бойлерів",
      "Виїзд по Дніпру"
    ],
    "usp": "Гарантія 2 роки, виїзд за 2 години, безкоштовна діагностика",
    "location": "Дніпро"
  },

  "audience": {
    "description": "Жінки 30-55, середній дохід, зламалась пральна машина — треба швидко",
    "problem": "Техніка зламалась, потрібен швидкий ремонт без переплат",
    "objections": "Бояться що обманут з ціною, що майстер не прийде вчасно"
  },

  "website": {
    "pages": ["Головна", "Послуги", "Про нас", "Контакти"],
    "primary_action": "Зателефонувати або залишити заявку на зворотній дзвінок",
    "special_features": "Прайс-лист по видах техніки, відгуки клієнтів"
  },

  "visual": {
    "references": "apple.com — чисто, сучасно. Не хочу як у всіх ремонтників.",
    "colors": "Синій, білий. Точно не рожевий.",
    "mood": "Надійний, професійний"
  },

  "content": {
    "existing_materials": "Логотип є, фото немає, тексти писатимемо самі",
    "additional_notes": "Сайт українською, потрібна мобільна версія обов'язково"
  }
}
