{
  "id": "kava",
  "created_at": "2026-03-17T12:00:00.000Z",
  "status": "expanded",
  "business": {
    "name": "KavaBAR",
    "description": "Невелика кавярня з баром на кілька столів та невеликою сценою для різних виступів — літераторів, музикантів, стендап-коміків",
    "services": [
      "Кавові напої (класичні та світові рецепти)",
      "Алкогольні коктейлі на основі кави",
      "Безалкогольні коктейлі",
      "Десерти",
      "Тематичні вечори (щочетверга та щосуботи)"
    ],
    "usp": "Повноцінний кава-бар зі світовими рецептами на основі кави (алкогольні та безалкогольні), тематичні вечори з виступами двічі на тиждень"
  },
  "audience": {
    "description": "Пари будь-якого віку, компанії дівчат до 30 років, чоловіки та жінки 35+ для ділових зустрічей, батьки з дітьми",
    "problem": "Потреба у затишному місці для відпочинку, де можна говорити і про кохання, і про бізнес. Острів спокою посеред шумного міста, де можна зупинитись на хвилиночку",
    "objections": "Не підходить для любителів звичайних барів (обмежений алкоголь), немає кальянів, не підходить для шумних компаній"
  },
  "website": {
    "pages": ["Головна", "Меню", "Події та новини", "Контакти"],
    "primary_action": "Забронювати столик, подивитись контакти, прокласти маршрут",
    "special_features": "Форма бронювання столика (менеджер передзвонює), меню з фільтрацією та детальним переглядом у попап/дровері"
  },
  "visual": {
    "references": "Відчуття спокою, бажання з'їсти сайт, зацікавленість в подіях",
    "colors": "Кавові тони, пісочні відтінки, акцентний колір для подій",
    "mood": "Спокій та задоволення"
  },
  "content": {
    "existing_materials": "Немає готових матеріалів",
    "additional_notes": "Немає"
  }
}